artigo,secao_artigo,pergunta,resposta_gabarito,resposta_rag,n_chunks_recuperados
tecnica difração cônica.pdf,[Seção 2 - Material and methods / Equação 1],Qual é a equação que relaciona o parâmetro β com as propriedades ópticas e térmicas do solvente na técnica de difração cônica e o que representa cada termo?,"O parâmetro β é dado por β = φLeff/(2πKλ) × (dn/dT), onde φ é a eficiência quântica não radiativa (fração da energia absorvida convertida em calor), Leff = (1−exp(−αL))/α é o comprimento efetivo, K é a condutividade térmica do solvente, λ é o comprimento de onda de excitação e dn/dT é o coeficiente termo-óptico. O número de anéis N segue a relação N = βPe, sendo Pe a potência do laser.",Não encontrei essa informação nos trechos recuperados.,40
tecnica difração cônica.pdf,[Seção 3 - Results and discussion / Tabela 3],De acordo com a Tabela 3 do artigo quais são os valores do rendimento quântico η e do parâmetro ηa obtidos para o derivado de vitamina B6 em DMSO pela técnica NCD?,"Para o derivado de vitamina B6 em DMSO os valores obtidos foram η = 0,75 ± 0,02 e ηa = 0,71.","De acordo com a Tabela 3 do artigo, os valores obtidos para o derivado de vitamina B6 em DMSO pela técnica NCD são:

*   **ηa:** 0.71
*   **η:** 0.75 ± 0.02

Fonte: tecnica difração cônica.pdf",40
tecnica difração cônica.pdf,[Seção 2 - Material and methods / configuração da cubeta],Por que a cubeta deve ser posicionada horizontalmente no setup experimental da técnica de difração cônica e qual é o efeito observado quando posicionada verticalmente?,A cubeta deve ser posicionada horizontalmente para evitar efeitos de convecção térmica dentro da amostra. Na posição vertical o fluxo de convecção distorce o padrão de frente de onda transmitida resultando em anéis não concêntricos no campo distante. Na posição horizontal a convecção é negligenciável e os anéis observados são bem concêntricos.,"A cubeta deve ser posicionada horizontalmente no setup experimental da técnica de difração cônica para evitar efeitos de convecção. [Trecho 2 | Fonte: tecnica difração cônica.pdf]

Quando a cubeta é posicionada verticalmente, observam-se anéis distorcidos e não concêntricos no padrão de campo distante. Este efeito é atribuído ao fluxo de convecção da solução dentro da cubeta, o que pode levar a distorções no padrão de onda transmitida. [Trecho 2 | Fonte: tecnica difração cônica.pdf]

Uma cubeta posicionada horizontalmente, com um comprimento de percurso curto, permite que a convecção seja negligenciada, resultando em anéis bem concêntricos observados no campo distante. [Trecho 1 | Fonte: tecnica difração cônica.pdf]",40
tecnica difração cônica.pdf,[Seção 3 - Results and discussion / Tabela 2],De acordo com a Tabela 2 do artigo qual é o valor da condutividade térmica K obtido para a água usando tinta azul-preta como amostra não fluorescente e qual é o erro percentual?,"O valor da condutividade térmica K obtido para a água é de 0,589 W/mK com erro de 2%.","De acordo com a Tabela 2 do artigo ""tecnica difração cônica.pdf"", o valor da condutividade térmica K obtido para a água usando tinta azul-preta como amostra não fluorescente é de 0.589 W/m K, com um erro percentual de 2%.",40
tecnica difração cônica.pdf,[Seção 4 - Conclusions / técnica NCD],O que é a técnica NCD (Normalized Conical Diffraction) e qual é sua principal vantagem em relação à técnica CD convencional?,A técnica NCD utiliza uma amostra de referência não fluorescente (φ=1) diluída no mesmo solvente da amostra de interesse para normalizar as medidas por meio da Equação 3. Sua principal vantagem é que não é necessário conhecer previamente o coeficiente termo-óptico (dn/dT) nem a condutividade térmica (K) do solvente para determinar o rendimento quântico η.,"A técnica NCD (Normalized Conical Diffraction) é uma evolução da técnica CD (Conical Diffraction) que utiliza uma amostra de referência não fluorescente para normalização. Sua principal vantagem em relação à técnica CD convencional é que ela permite a determinação do rendimento quântico de fluorescência (η) sem a necessidade de conhecer previamente os coeficientes de condutividade térmica (K) e termo-óptico (dn/dT) da amostra. Em outras palavras, a técnica NCD simplifica o processo, eliminando a necessidade de medições adicionais ou informações prévias sobre as propriedades térmicas do solvente. [Trecho 1, Trecho 4, Trecho 5]",40
PCA.pdf,[Seção 2.2 - PCA model construction],Qual software e pacotes foram utilizados para construir o modelo PCA neste estudo e qual foi o primeiro passo do processo de construção do modelo?,O modelo PCA foi construído usando o software R no ambiente de programação Rstudio com os pacotes FactoMineR e Factoextra para obter a matriz de covariância e a distribuição de variância. O primeiro passo foi a padronização dos dados subtraindo a média aritmética e dividindo pelo desvio padrão de cada variável garantindo que todas as variáveis contribuíssem igualmente para a análise.,"Para construir o modelo PCA, foram utilizados o software R e os pacotes FactoMineR e Factoextra. O primeiro passo no processo de construção do modelo PCA foi a padronização dos dados originais. Isso foi feito subtraindo a média aritmética de cada valor e dividindo pelo desvio padrão correspondente (PCA.pdf, p. 2).",40
PCA.pdf,[Seção 3 - Results / dois primeiros PCs],"Qual é o percentual de variância explicado pelos dois primeiros componentes principais (PC1 e PC2) no modelo PCA dos derivados de imidazo[4,5-b]piridina?","Os dois primeiros componentes principais explicam coletivamente 93% da variância total com o PC1 respondendo por 80,2% e o PC2 por 13,6% da variância.","Os dois primeiros componentes principais (PC1 e PC2) explicaram coletivamente 93% da variância, sendo que o primeiro componente principal (PC1) explicou 80,2% e o segundo componente principal (PC2) explicou 13,6% da variância total [Trecho 2 | Fonte: PCA.pdf].",40
PCA.pdf,[Seção 2.2 - PCA model construction / padronização],Por que a padronização dos dados com média zero e desvio padrão unitário foi necessária antes de aplicar a PCA neste estudo?,A padronização foi necessária porque as variáveis do conjunto de dados possuem diferentes unidades e escalas. Sem ela a PCA seria dominada pelas variáveis com maiores magnitudes numéricas prejudicando a identificação correta dos componentes principais. A padronização garante que todas as variáveis contribuam igualmente para a análise.,"A padronização dos dados com média zero e desvio padrão unitário foi necessária antes de aplicar a PCA para garantir que todos os componentes principais (PCs) fossem identificados com base na direção de maior variação (variância máxima), sem que a magnitude de uma variável influenciasse indevidamente o cálculo dos PCs [Trecho 2 | Fonte: PCA.pdf, Trecho 4 | Fonte: PCA.pdf]. Em um conjunto de dados não padronizado, a variável com a maior magnitude poderia dominar o cálculo dos PCs [Trecho 2 | Fonte: PCA.pdf]. A padronização assegura que todas as variáveis contribuam igualmente para a análise [Trecho 26 | Fonte: PCA.pdf].",40
PCA.pdf,[Seção 2.2 - PCA model construction / Score e Loading plots],O que são o Score plot e o Loading plot na análise PCA e qual informação cada um fornece?,O Score plot mostra a distribuição espacial das amostras (moléculas) no espaço dos componentes principais indicando distâncias relativas e agrupamentos entre grupos como A-Imp-A e A-Imp-D. O Loading plot (gráfico de cos²θ) mostra a correlação entre as variáveis descritoras em termos da relação angular entre elas no espaço dos componentes permitindo identificar quais variáveis mais contribuem para cada componente principal.,"Com base nos trechos fornecidos, o Score plot e o Loading plot são ferramentas utilizadas na Análise de Componentes Principais (PCA) para interpretar dados.

*   **Score plot:** Mostra a distribuição espacial dos indivíduos (ou amostras) no espaço dos componentes. Ele indica a distância de cada observação em relação aos eixos primários e permite observar a separação e o agrupamento de amostras com base em suas características (PCA.pdf, trecho 8). Também permite comparar a orientação do objeto no espaço dos componentes (PCA.pdf, trecho 3). Em resumo, o Score plot visualiza como as amostras se agrupam ou se separam com base nas componentes principais.

*   **Loading plot:** É também conhecido como ""cos²(θ) plot"" e permite observar a correlação entre as variáveis descritoras em termos da relação angular entre elas (PCA.pdf, trecho 8). Ele mostra a contribuição de cada variável para a construção dos componentes principais e ajuda a entender quais variáveis são mais influentes (PCA.pdf, trechos 2 e 3). O Loading plot filtrado, sem variáveis com contribuição menor que 30% da variabilidade total dos dados, destaca as variáveis mais importantes para a construção das componentes principais (PCA.pdf, trecho 2). Em resumo, o Loading plot revela as relações entre as variáveis e sua importância para as componentes principais.",40
PCA.pdf,[Seção 3 - Results / regressão linear PCA e grupos A-Imp-A vs A-Imp-D],De acordo com o modelo de regressão linear PCA qual grupo de compostos (A-Imp-A ou A-Imp-D) apresenta maior influência do PC1 nos valores de seção transversal de 2PA e qual é a implicação desse resultado?,As moléculas do grupo A-Imp-D apresentam maior influência do PC1 nos valores de σ2PA com correlação positiva mais forte. Isso indica que variáveis altamente correlacionadas com o PC1 como o momento de dipolo de transição (μ₀₁) a mudança de dipolo permanente (Δμ₀₁) e o deslocamento de Stokes normalizado pelo fator de Onsager (Δν/ΔF) têm maior impacto no σ2PA desse grupo. Para as moléculas A-Imp-A o PC2 tem maior influência sendo dominado por μ₀₂ e pelo rendimento quântico de fluorescência (φf).,"De acordo com o modelo de regressão linear, o grupo A-Imp-D apresenta maior influência do PC1 nos valores de seção transversal de 2PA. Isso implica que o PC1 tem uma maior influência nas moléculas deste grupo, sugerindo uma relação mais forte entre as variáveis correlacionadas com o PC1 e a seção transversal de 2PA para o grupo A-Imp-D (PCA.pdf, Trecho 4).",40
2020_Two-Photon Emissive Dyes Based on Push−Pull Purines Derivatives.pdf,[Seção II.2 - Linear and Nonlinear Optical Measurements / solventes e Z-scan],Quais solventes foram utilizados para dissolver os compostos estudados e qual técnica foi usada para medir a seção transversal de absorção de dois fótons (σ2PA)?,Os compostos 3a a 3g foram dissolvidos em diclorometano (DCM) enquanto os compostos 7a e 7b foram dissolvidos em dimetilsulfóxido (DMSO). A seção transversal de absorção de dois fótons foi medida usando a técnica Z-scan de abertura aberta (open-aperture Z-scan) com um laser de femtossegundos sintonizável.,"Os solventes utilizados para dissolver os compostos estudados foram acetona, etanol, metanol, diclorometano (DCM), dimetilsulfóxido (DMSO) e tolueno [11].

A técnica utilizada para medir a seção transversal de absorção de dois fótons (σ2PA) foi a Z-scan [29].",40
2020_Two-Photon Emissive Dyes Based on Push−Pull Purines Derivatives.pdf,[Seção II.2 - Linear Optical Measurements / Tabela 1 / φf],Quais são os valores do rendimento quântico de fluorescência (φf) dos compostos 3b e 7b e o que esses valores indicam sobre o caráter emissivo desses compostos?,O composto 3b apresenta φf = 81% e o composto 7b apresenta φf = 99%. Esses altos valores indicam que ambos são altamente emissivos com decaimento predominantemente radiativo (kr >> knr) sendo candidatos promissores como biossondas fotoluminescentes ativadas por absorção de dois fótons.,"Com base nos trechos recuperados:

Os valores do rendimento quântico de fluorescência (ϕf) para os compostos 3b e 7b não são explicitamente mencionados de forma individual nos trechos. No entanto, o **Trecho 1** indica que ""Todos os compostos estudados têm valores de ϕf acima de 60%"" e que ""Os valores de 2 AP ϕf [dos compostos estudados] estão em torno de 68%"". O mesmo trecho também afirma que os valores de ϕf obtidos neste trabalho variam de 62% a 99%.

O **Trecho 1** também explica que valores altos de ϕf (acima de 60%) geralmente indicam que os compostos emissivos têm uma desintegração radiativa eficaz do primeiro estado excitado para o estado fundamental. Isso significa que a probabilidade de decaimento por emissão de fóton (k_r) é muito maior do que o decaimento não radiativo (k_nr), resultando em maior emissão de luz.

Em relação especificamente ao composto 7b, o **Trecho 1** menciona que ele pertence ao grupo II e que, para este composto, há a ""maior diferença entre k_r e k_nr"", o que é esperado devido ao seu alto ϕf.

Portanto, embora os valores exatos para 3b e 7b não sejam fornecidos separadamente, os trechos indicam que ambos os compostos, assim como os demais estudados, possuem altos rendimentos quânticos de fluorescência (acima de 60%, e especificamente o 7b contribuindo para a alta emissão do grupo II), o que sugere um forte caráter emissivo devido à predominância de decaimento radiativo.",40
2020_Two-Photon Emissive Dyes Based on Push−Pull Purines Derivatives.pdf,[Seção III - Conclusions / comparação com 2AP e janela terapêutica],Por que os espectros de 2PA das purinas push-pull estudadas apresentam redshift em relação à 2-aminopurina (2AP) e qual é a relevância desse deslocamento para aplicações biomédicas?,"O redshift ocorre porque a adição de grupos push-pull e do linker estirila à estrutura da purina aumenta o comprimento de conjugação π e o caráter dipolar das moléculas reduzindo a energia dos estados excitados. Enquanto as bandas de 2PA da 2AP estão centradas entre 600 e 650 nm as das purinas derivadas estão em 700–800 nm (1,77–1,55 eV) coincidindo com a janela terapêutica de penetração óptica em tecidos biológicos o que as torna mais adequadas para bioimagem por microscopia de dois fótons.","Os espectros de 2PA (absorção de dois fótons) das purinas push-pull estudadas apresentam um redshift (deslocamento para o vermelho) em relação à 2-aminopurina (2AP) devido ao aumento do comprimento de conjugação e ao caráter dipolar forte dos grupos push-pull. Essa combinação resulta em um aumento na seção de choque de absorção de dois fótons (2 PA cross-section) (2020_Two-Photon Emissive Dyes Based on Push−Pull Purines Derivatives.pdf).

A relevância desse deslocamento para aplicações biomédicas reside no fato de que o espectro deslocado para o vermelho se aproxima da ""janela terapêutica"" (therapeutic window). Uma das bandas de absorção de 2PA estudadas tem seu centro de seção de choque máxima em torno de 750 nm. Essa faixa de comprimento de onda permite uma melhor penetração do feixe de laser em tecidos de mamíferos, o que, por sua vez, pode aumentar a relação sinal-ruído na aquisição de emissões de fluorescência em estudos in vivo (2020_Two-Photon Emissive Dyes Based on Push−Pull Purines Derivatives.pdf).",40
2020_Two-Photon Emissive Dyes Based on Push−Pull Purines Derivatives.pdf,[Seção II.2 - Brightness / Fig. 4],O que é o parâmetro brilho (brightness) utilizado no artigo como ele foi calculado e qual composto apresentou o maior valor de brilho a 560 nm?,O brilho é definido como o produto do rendimento quântico de fluorescência (φf) pela seção transversal de absorção de dois fótons (σ2PA) em um comprimento de onda específico: brilho = φf × σ2PA(λ). No estudo o brilho foi avaliado em 560 nm e 780 nm. O composto 3c apresentou o maior valor de brilho a 560 nm com 92 GM.,"O parâmetro brilho (brightness) é definido como o produto do rendimento quântico de fluorescência (ϕf) pela seção de choque de absorção de dois fótons (σ2PA) em um determinado comprimento de onda: ϕf × σ2PA(λ) [Trecho 1].

Para calcular o brilho, foram selecionados os comprimentos de onda de 560 nm e 780 nm. A análise mostrou que a excitação com o comprimento de onda mais curto (560 nm) apresentou valores de brilho mais elevados em comparação com o comprimento de onda mais longo (780 nm) [Trecho 1].

Não encontrei nos trechos recuperados qual composto específico apresentou o maior valor de brilho a 560 nm. No entanto, os valores de brilho para os compostos investigados foram estimados utilizando os valores da seção de choque de absorção de dois fótons (2PA) e o rendimento quântico de fluorescência [Trecho 1, Trecho 12]. O artigo menciona que a adição de grupos estiril e push-pull aumentou o comprimento de conjugação e o caráter dipolar das moléculas, o que pode ter desencadeado um aumento nos valores de brilho [Trecho 22].",40
2020_Two-Photon Emissive Dyes Based on Push−Pull Purines Derivatives.pdf,[Seção II.2 - Linear Optical Measurements / Lippert-Mataga e raio cúbico],Como o momento de dipolo elétrico permanente (Δμ₀₁) foi estimado nos compostos estudados e como o raio cúbico molecular (a³) foi determinado?,O momento de dipolo permanente Δμ₀₁ foi estimado aplicando a equação de Lippert-Mataga às medidas de solvatocromismo em seis solventes (acetona etanol metanol DCM DMSO e tolueno). O raio cúbico molecular a³ foi determinado assumindo que cada estrutura molecular ocupa um volume esférico (Vol = 4πa³/3) e aplicando a equação de difusão de Smoluchowski-Einstein; adicionalmente foi calculado usando o pacote Gaussian 16.,"O momento de dipolo elétrico permanente ($\Delta\mu_{01}$) foi estimado aplicando a equação de Lippert-Mataga, utilizando parâmetros obtidos a partir de medições ópticas lineares. Todos os parâmetros necessários para essa equação foram adquiridos e calculados com as medições ópticas lineares já descritas, exceto pelo raio cúbico molecular ($a^3$). [Trecho 2 | Fonte: 2020_Two-Photon Emissive Dyes Based on Push−Pull Purines Derivatives.pdf]

Para determinar o raio cúbico molecular ($a^3$), assumiu-se que cada estrutura molecular ocupa um volume esférico ($Vol = 4\pi a^3$). Aplicando a equação de difusão de Smoluchowski-Einstein, os valores de $a^3$ foram obtidos em Angstroms. O $a^3$ estimado foi de aproximadamente 250-300 Å³ para todas as estruturas moleculares. O raio cúbico também foi calculado usando o pacote de programas Gaussian 16, demonstrando boa concordância com os valores derivados experimentalmente, considerando o erro experimental. [Trecho 2 | Fonte: 2020_Two-Photon Emissive Dyes Based on Push−Pull Purines Derivatives.pdf]",40
